No.,Time,Source,Destination,Protocol,Length,Info
1,0,10.97.172.240,52.21.103.149,TCP,78,54831  >  443 [SYN] Seq=0 Win=65535 Len=0 MSS=1460 WS=64 TSval=1089640327 TSecr=0 SACK_PERM=1
2,0.082079,52.21.103.149,10.97.172.240,TCP,66,"443  >  54831 [SYN, ACK] Seq=0 Ack=1 Win=26883 Len=0 MSS=1380 SACK_PERM=1 WS=256"
3,0.082252,10.97.172.240,52.21.103.149,TCP,54,54831  >  443 [ACK] Seq=1 Ack=1 Win=262144 Len=0
4,0.083455,10.97.172.240,52.21.103.149,TLSv1.2,309,Client Hello
5,0.16465,52.21.103.149,10.97.172.240,TCP,54,443  >  54831 [ACK] Seq=1 Ack=256 Win=28160 Len=0
6,0.169221,52.21.103.149,10.97.172.240,TLSv1.2,1434,Server Hello
7,0.169231,52.21.103.149,10.97.172.240,TCP,1434,443  >  54831 [ACK] Seq=1381 Ack=256 Win=28160 Len=1380 [TCP segment of a reassembled PDU]
8,0.169233,52.21.103.149,10.97.172.240,TLSv1.2,496,"Certificate, Server Key Exchange, Server Hello Done"
9,0.169358,10.97.172.240,52.21.103.149,TCP,54,54831  >  443 [ACK] Seq=256 Ack=2761 Win=259328 Len=0
10,0.16936,10.97.172.240,52.21.103.149,TCP,54,54831  >  443 [ACK] Seq=256 Ack=3203 Win=258880 Len=0
11,0.169485,10.97.172.240,52.21.103.149,TCP,54,[TCP Window Update] 54831  >  443 [ACK] Seq=256 Ack=3203 Win=262144 Len=0
12,0.228251,10.97.172.240,52.21.103.149,TLSv1.2,180,"Client Key Exchange, Change Cipher Spec, Encrypted Handshake Message"
13,0.31155,52.21.103.149,10.97.172.240,TLSv1.2,105,"Change Cipher Spec, Encrypted Handshake Message"
14,0.311678,10.97.172.240,52.21.103.149,TCP,54,54831  >  443 [ACK] Seq=382 Ack=3254 Win=262080 Len=0
15,0.313265,10.97.172.240,52.21.103.149,TLSv1.2,741,Application Data
16,0.468444,52.21.103.149,10.97.172.240,TCP,54,443  >  54831 [ACK] Seq=3254 Ack=1069 Win=29440 Len=0
17,0.483855,52.21.103.149,10.97.172.240,TLSv1.2,1019,Application Data
18,0.483938,10.97.172.240,52.21.103.149,TCP,54,54831  >  443 [ACK] Seq=1069 Ack=4219 Win=261120 Len=0
19,0.484752,52.21.103.149,10.97.172.240,TLSv1.2,256,Application Data
20,0.48476,52.21.103.149,10.97.172.240,TLSv1.2,88,Application Data
21,0.484861,10.97.172.240,52.21.103.149,TCP,54,54831  >  443 [ACK] Seq=1069 Ack=4421 Win=261888 Len=0
22,0.484861,10.97.172.240,52.21.103.149,TCP,54,54831  >  443 [ACK] Seq=1069 Ack=4455 Win=261888 Len=0
23,0.497275,10.97.172.240,162.125.18.133,TCP,54,"53359  >  443 [FIN, ACK] Seq=1 Ack=1 Win=4096 Len=0"
24,0.497879,10.97.172.240,162.125.18.133,TCP,54,"54122  >  443 [FIN, ACK] Seq=1 Ack=1 Win=4096 Len=0"
25,0.505542,10.97.172.240,193.60.250.1,DNS,78,Standard query 0xd88f A bolt.v.dropbox.com
26,0.508226,193.60.250.1,10.97.172.240,DNS,294,Standard query response 0xd88f A bolt.v.dropbox.com A 162.125.18.133 NS ns-773.awsdns-32.net NS ns-1926.awsdns-48.co.uk NS ns-1276.awsdns-31.org NS ns-57.awsdns-07.com A 205.251.196.252 A 205.251.199.134 A 205.251.192.57 A 205.251.195.5
27,0.509787,10.97.172.240,162.125.18.133,TCP,78,54834  >  443 [SYN] Seq=0 Win=65535 Len=0 MSS=1460 WS=64 TSval=1089640829 TSecr=0 SACK_PERM=1
28,0.517038,10.97.172.240,162.125.18.133,TCP,78,54835  >  443 [SYN] Seq=0 Win=65535 Len=0 MSS=1460 WS=64 TSval=1089640836 TSecr=0 SACK_PERM=1
29,0.524026,10.97.172.240,162.125.18.133,TCP,78,54836  >  443 [SYN] Seq=0 Win=65535 Len=0 MSS=1460 WS=64 TSval=1089640842 TSecr=0 SACK_PERM=1
30,0.530291,10.97.172.240,162.125.18.133,TCP,78,54837  >  443 [SYN] Seq=0 Win=65535 Len=0 MSS=1460 WS=64 TSval=1089640848 TSecr=0 SACK_PERM=1
31,0.575354,162.125.18.133,10.97.172.240,TLSv1.2,85,Encrypted Alert
32,0.575429,10.97.172.240,162.125.18.133,TCP,54,53359  >  443 [RST] Seq=2 Win=0 Len=0
33,0.576105,162.125.18.133,10.97.172.240,TCP,54,"443  >  53359 [FIN, ACK] Seq=32 Ack=2 Win=302 Len=0"
34,0.576107,162.125.18.133,10.97.172.240,TLSv1.2,85,Encrypted Alert
35,0.576138,10.97.172.240,162.125.18.133,TCP,54,53359  >  443 [RST] Seq=2 Win=0 Len=0
36,0.576166,10.97.172.240,162.125.18.133,TCP,54,54122  >  443 [RST] Seq=2 Win=0 Len=0
37,0.57632,162.125.18.133,10.97.172.240,TCP,54,"443  >  54122 [FIN, ACK] Seq=32 Ack=2 Win=223 Len=0"
38,0.57634,10.97.172.240,162.125.18.133,TCP,54,54122  >  443 [RST] Seq=2 Win=0 Len=0
39,0.584819,162.125.18.133,10.97.172.240,TCP,66,"443  >  54834 [SYN, ACK] Seq=0 Ack=1 Win=28800 Len=0 MSS=1380 SACK_PERM=1 WS=512"
40,0.584882,10.97.172.240,162.125.18.133,TCP,54,54834  >  443 [RST] Seq=1 Win=0 Len=0
41,0.595098,162.125.18.133,10.97.172.240,TCP,66,"443  >  54835 [SYN, ACK] Seq=0 Ack=1 Win=28800 Len=0 MSS=1380 SACK_PERM=1 WS=512"
42,0.595145,10.97.172.240,162.125.18.133,TCP,54,54835  >  443 [RST] Seq=1 Win=0 Len=0
43,0.605222,162.125.18.133,10.97.172.240,TCP,66,"443  >  54836 [SYN, ACK] Seq=0 Ack=1 Win=28800 Len=0 MSS=1380 SACK_PERM=1 WS=512"
44,0.605286,10.97.172.240,162.125.18.133,TCP,54,54836  >  443 [ACK] Seq=1 Ack=1 Win=262144 Len=0
45,0.606422,10.97.172.240,162.125.18.133,TLSv1.2,235,Client Hello
46,0.611115,162.125.18.133,10.97.172.240,TCP,66,"443  >  54837 [SYN, ACK] Seq=0 Ack=1 Win=28800 Len=0 MSS=1380 SACK_PERM=1 WS=512"
47,0.61118,10.97.172.240,162.125.18.133,TCP,54,54837  >  443 [ACK] Seq=1 Ack=1 Win=262144 Len=0
48,0.613614,10.97.172.240,162.125.18.133,TLSv1.2,235,Client Hello
49,0.687482,162.125.18.133,10.97.172.240,TCP,54,443  >  54836 [ACK] Seq=1 Ack=182 Win=30208 Len=0
50,0.6887,162.125.18.133,10.97.172.240,TLSv1.2,1434,Server Hello
51,0.688703,162.125.18.133,10.97.172.240,TCP,1434,443  >  54836 [ACK] Seq=1381 Ack=182 Win=30208 Len=1380 [TCP segment of a reassembled PDU]
52,0.688704,162.125.18.133,10.97.172.240,TLSv1.2,713,"Certificate, Server Key Exchange, Server Hello Done"
53,0.688753,10.97.172.240,162.125.18.133,TCP,54,54836  >  443 [ACK] Seq=182 Ack=2761 Win=259328 Len=0
54,0.688753,10.97.172.240,162.125.18.133,TCP,54,54836  >  443 [ACK] Seq=182 Ack=3420 Win=258688 Len=0
55,0.689764,10.97.172.240,162.125.18.133,TCP,54,[TCP Window Update] 54836  >  443 [ACK] Seq=182 Ack=3420 Win=261760 Len=0
56,0.690754,10.97.172.240,162.125.18.133,TLSv1.2,180,"Client Key Exchange, Change Cipher Spec, Encrypted Handshake Message"
57,0.694018,162.125.18.133,10.97.172.240,TCP,54,443  >  54837 [ACK] Seq=1 Ack=182 Win=30208 Len=0
58,0.695469,162.125.18.133,10.97.172.240,TLSv1.2,1434,Server Hello
59,0.695475,162.125.18.133,10.97.172.240,TCP,713,"[TCP Previous segment not captured] 443  >  54837 [PSH, ACK] Seq=2761 Ack=182 Win=30208 Len=659 [TCP segment of a reassembled PDU], Server Key Exchange, Server Hello Done"
60,0.695476,162.125.18.133,10.97.172.240,TCP,1434,[TCP Out-Of-Order] 443  >  54837 [ACK] Seq=1381 Ack=182 Win=30208 Len=1380
61,0.695579,10.97.172.240,162.125.18.133,TCP,66,54837  >  443 [ACK] Seq=182 Ack=1381 Win=260736 Len=0 SLE=2761 SRE=3420
62,0.695579,10.97.172.240,162.125.18.133,TCP,54,54837  >  443 [ACK] Seq=182 Ack=3420 Win=258688 Len=0
63,0.695745,10.97.172.240,162.125.18.133,TCP,54,[TCP Window Update] 54837  >  443 [ACK] Seq=182 Ack=3420 Win=261760 Len=0
64,0.697009,10.97.172.240,162.125.18.133,TLSv1.2,180,"Client Key Exchange, Change Cipher Spec, Encrypted Handshake Message"
65,0.735817,10.97.172.240,216.58.206.142,TLSv1.2,85,Encrypted Alert
66,0.735817,10.97.172.240,216.58.206.142,TCP,54,"54777  >  443 [FIN, ACK] Seq=32 Ack=1 Win=4096 Len=0"
67,0.738671,216.58.206.142,10.97.172.240,TCP,54,443  >  54777 [ACK] Seq=1 Ack=32 Win=306 Len=0
68,0.739034,216.58.206.142,10.97.172.240,TCP,54,"443  >  54777 [FIN, ACK] Seq=1 Ack=33 Win=306 Len=0"
69,0.739088,10.97.172.240,216.58.206.142,TCP,54,54777  >  443 [ACK] Seq=33 Ack=2 Win=4096 Len=0
70,0.774443,162.125.18.133,10.97.172.240,TLSv1.2,296,"New Session Ticket, Change Cipher Spec, Encrypted Handshake Message"
71,0.774501,10.97.172.240,162.125.18.133,TCP,54,54836  >  443 [ACK] Seq=308 Ack=3662 Win=261888 Len=0
72,0.776848,10.97.172.240,162.125.18.133,TLSv1.2,519,Application Data
73,0.777814,162.125.18.133,10.97.172.240,TLSv1.2,296,"New Session Ticket, Change Cipher Spec, Encrypted Handshake Message"
74,0.777895,10.97.172.240,162.125.18.133,TCP,54,54837  >  443 [ACK] Seq=308 Ack=3662 Win=261888 Len=0
75,0.77895,10.97.172.240,162.125.18.133,TLSv1.2,519,Application Data
76,0.990878,162.125.18.133,10.97.172.240,TCP,54,443  >  54836 [ACK] Seq=3662 Ack=773 Win=31232 Len=0
77,0.990971,10.97.172.240,162.125.18.133,TLSv1.2,560,Application Data
78,0.991398,162.125.18.133,10.97.172.240,TCP,54,443  >  54837 [ACK] Seq=3662 Ack=773 Win=31232 Len=0
79,0.991486,10.97.172.240,162.125.18.133,TLSv1.2,639,Application Data
80,1.073776,162.125.18.133,10.97.172.240,TCP,54,443  >  54837 [ACK] Seq=3662 Ack=1358 Win=32256 Len=0
81,1.073951,162.125.18.133,10.97.172.240,TCP,54,443  >  54836 [ACK] Seq=3662 Ack=1279 Win=32256 Len=0
82,4.517173,10.97.172.240,193.60.250.1,DNS,96,Standard query 0xe803 A googlehosted.l.googleusercontent.com
83,4.520831,193.60.250.1,10.97.172.240,DNS,367,Standard query response 0xe803 A googlehosted.l.googleusercontent.com A 216.58.206.129 NS ns2.google.com NS ns1.google.com NS ns3.google.com NS ns4.google.com A 216.239.34.10 AAAA 2001:4860:4802:34::a A 216.239.32.10 AAAA 2001:4860:4802:32::a A 216.239.38.10 AAAA 2001:4860:4802:38::a A 216.239.36.10 AAAA 2001:4860:4802:36::a
84,4.522246,10.97.172.240,216.58.206.129,TCP,78,54838  >  443 [SYN] Seq=0 Win=65535 Len=0 MSS=1460 WS=64 TSval=1089644825 TSecr=0 SACK_PERM=1
85,4.524834,216.58.206.129,10.97.172.240,TCP,66,"443  >  54838 [SYN, ACK] Seq=0 Ack=1 Win=60720 Len=0 MSS=1380 SACK_PERM=1 WS=256"
86,4.524903,10.97.172.240,216.58.206.129,TCP,54,54838  >  443 [ACK] Seq=1 Ack=1 Win=262144 Len=0
87,4.526233,10.97.172.240,216.58.206.129,TLSv1.2,571,Client Hello
88,4.528896,216.58.206.129,10.97.172.240,TCP,54,443  >  54838 [ACK] Seq=1 Ack=518 Win=61952 Len=0
89,4.529103,216.58.206.129,10.97.172.240,TLSv1.2,216,"Server Hello, Change Cipher Spec, Encrypted Handshake Message"
90,4.529147,10.97.172.240,216.58.206.129,TCP,54,54838  >  443 [ACK] Seq=518 Ack=163 Win=261952 Len=0
91,4.5297,10.97.172.240,216.58.206.129,TLSv1.2,105,"Change Cipher Spec, Encrypted Handshake Message"
92,4.573092,216.58.206.129,10.97.172.240,TCP,54,443  >  54838 [ACK] Seq=163 Ack=569 Win=61952 Len=0
93,4.666103,10.97.172.240,216.58.206.129,TLSv1.2,579,Application Data
94,4.666679,10.97.172.240,216.58.206.129,TCP,1434,54838  >  443 [ACK] Seq=1094 Ack=163 Win=262144 Len=1380 [TCP segment of a reassembled PDU]
95,4.66668,10.97.172.240,216.58.206.129,TLSv1.2,920,Application Data
96,4.669677,216.58.206.129,10.97.172.240,TCP,54,443  >  54838 [ACK] Seq=163 Ack=1094 Win=62976 Len=0
97,4.66968,216.58.206.129,10.97.172.240,TCP,54,443  >  54838 [ACK] Seq=163 Ack=2474 Win=65792 Len=0
98,4.670658,216.58.206.129,10.97.172.240,TCP,54,443  >  54838 [ACK] Seq=163 Ack=3340 Win=68608 Len=0
99,4.959234,216.58.206.129,10.97.172.240,TLSv1.2,504,Application Data
100,4.959239,216.58.206.129,10.97.172.240,TLSv1.2,1434,Application Data
101,4.959291,10.97.172.240,216.58.206.129,TCP,54,54838  >  443 [ACK] Seq=3340 Ack=613 Win=261632 Len=0
102,4.959291,10.97.172.240,216.58.206.129,TCP,54,54838  >  443 [ACK] Seq=3340 Ack=1993 Win=260288 Len=0
103,4.959554,216.58.206.129,10.97.172.240,TLSv1.2,318,Application Data
104,4.959556,216.58.206.129,10.97.172.240,TLSv1.2,88,Application Data
105,4.959557,216.58.206.129,10.97.172.240,TCP,88,"[TCP Retransmission] 443  >  54838 [PSH, ACK] Seq=2257 Ack=3340 Win=68608 Len=34"
106,4.959585,10.97.172.240,216.58.206.129,TCP,54,54838  >  443 [ACK] Seq=3340 Ack=2257 Win=261824 Len=0
107,4.959585,10.97.172.240,216.58.206.129,TCP,54,54838  >  443 [ACK] Seq=3340 Ack=2291 Win=261824 Len=0
108,4.959594,10.97.172.240,216.58.206.129,TCP,66,[TCP Dup ACK 107#1] 54838  >  443 [ACK] Seq=3340 Ack=2291 Win=261824 Len=0 SLE=2257 SRE=2291
109,4.973926,10.97.172.240,216.58.206.129,TLSv1.2,535,Application Data
110,4.973973,10.97.172.240,216.58.206.129,TLSv1.2,508,Application Data
111,4.979649,216.58.206.129,10.97.172.240,TCP,54,443  >  54838 [ACK] Seq=2291 Ack=3821 Win=71168 Len=0
112,4.982399,216.58.206.129,10.97.172.240,TCP,54,443  >  54838 [ACK] Seq=2291 Ack=4275 Win=73984 Len=0
113,4.988646,216.58.206.129,10.97.172.240,TLSv1.2,527,Application Data
114,4.988649,216.58.206.129,10.97.172.240,TLSv1.2,295,Application Data
115,4.988704,10.97.172.240,216.58.206.129,TCP,54,54838  >  443 [ACK] Seq=4275 Ack=2764 Win=261632 Len=0
116,4.988705,10.97.172.240,216.58.206.129,TCP,54,54838  >  443 [ACK] Seq=4275 Ack=3005 Win=261376 Len=0
117,4.988764,216.58.206.129,10.97.172.240,TLSv1.2,88,Application Data
118,4.988791,10.97.172.240,216.58.206.129,TCP,54,54838  >  443 [ACK] Seq=4275 Ack=3039 Win=262080 Len=0
119,4.99745,10.97.172.240,216.58.206.129,TLSv1.2,535,Application Data
120,4.99745,10.97.172.240,216.58.206.129,TLSv1.2,513,Application Data
121,5.000601,216.58.206.129,10.97.172.240,TCP,54,443  >  54838 [ACK] Seq=3039 Ack=5215 Win=79616 Len=0
122,5.00912,216.58.206.129,10.97.172.240,TLSv1.2,527,Application Data
123,5.009123,216.58.206.129,10.97.172.240,TLSv1.2,316,Application Data
124,5.009167,10.97.172.240,216.58.206.129,TCP,54,54838  >  443 [ACK] Seq=5215 Ack=3512 Win=261632 Len=0
125,5.009168,10.97.172.240,216.58.206.129,TCP,54,54838  >  443 [ACK] Seq=5215 Ack=3774 Win=261376 Len=0
126,5.009222,216.58.206.129,10.97.172.240,TLSv1.2,88,Application Data
127,5.009243,10.97.172.240,216.58.206.129,TCP,54,54838  >  443 [ACK] Seq=5215 Ack=3808 Win=262080 Len=0
128,6.592101,10.97.172.240,193.60.250.1,DNS,81,Standard query 0x90b0 A config.edge.skype.com
129,6.594147,10.97.172.240,193.60.250.1,DNS,91,Standard query 0xed4d A client-office365-tas.msedge.net
130,6.596294,193.60.250.1,10.97.172.240,DNS,198,Standard query response 0x90b0 A config.edge.skype.com CNAME s-0001.s-msedge.net A 13.107.3.128 NS ns1.s-msedge.net NS ns2.s-msedge.net A 13.107.3.1 A 13.107.3.2
131,6.597361,193.60.250.1,10.97.172.240,DNS,453,Standard query response 0xed4d A client-office365-tas.msedge.net CNAME afdo-tas-offload.trafficmanager.net CNAME vip5.afdorigin-prod-am02.afdogw.com A 52.232.69.150 NS ns4-06.azure-dns.info NS ns2-06.azure-dns.net NS ns3-06.azure-dns.org NS ns1-06.azure-dns.com A 40.90.4.6 AAAA 2603:1061::6 A 64.4.48.6 A 13.107.24.6 AAAA 2a01:111:4000::6 A 13.107.160.6
132,6.59738,10.97.172.240,13.107.3.128,TCP,78,54839  >  443 [SYN] Seq=0 Win=65535 Len=0 MSS=1460 WS=64 TSval=1089646883 TSecr=0 SACK_PERM=1
133,6.598622,10.97.172.240,52.232.69.150,TCP,78,54840  >  443 [SYN] Seq=0 Win=65535 Len=0 MSS=1460 WS=64 TSval=1089646884 TSecr=0 SACK_PERM=1
134,6.602403,13.107.3.128,10.97.172.240,TCP,66,"443  >  54839 [SYN, ACK] Seq=0 Ack=1 Win=65535 Len=0 MSS=1380 WS=256 SACK_PERM=1"
135,6.602473,10.97.172.240,13.107.3.128,TCP,54,54839  >  443 [ACK] Seq=1 Ack=1 Win=262144 Len=0
136,6.603269,10.97.172.240,13.107.3.128,TLSv1.2,235,Client Hello
137,6.607586,13.107.3.128,10.97.172.240,TCP,54,443  >  54839 [ACK] Seq=1 Ack=182 Win=524032 Len=0
138,6.608919,13.107.3.128,10.97.172.240,TCP,1434,443  >  54839 [ACK] Seq=1 Ack=182 Win=524032 Len=1380 [TCP segment of a reassembled PDU]
139,6.608927,13.107.3.128,10.97.172.240,TCP,1434,443  >  54839 [ACK] Seq=1381 Ack=182 Win=524032 Len=1380 [TCP segment of a reassembled PDU]
140,6.60893,13.107.3.128,10.97.172.240,TCP,1434,443  >  54839 [ACK] Seq=2761 Ack=182 Win=524032 Len=1380 [TCP segment of a reassembled PDU]
141,6.608932,13.107.3.128,10.97.172.240,TCP,1434,443  >  54839 [ACK] Seq=4141 Ack=182 Win=524032 Len=1380 [TCP segment of a reassembled PDU]
142,6.608934,13.107.3.128,10.97.172.240,TLSv1.2,917,"Server Hello, Certificate, Certificate Status, Server Key Exchange, Server Hello Done"
143,6.609116,10.97.172.240,13.107.3.128,TCP,54,54839  >  443 [ACK] Seq=182 Ack=2761 Win=259328 Len=0
144,6.609117,10.97.172.240,13.107.3.128,TCP,54,54839  >  443 [ACK] Seq=182 Ack=5521 Win=256576 Len=0
145,6.609118,10.97.172.240,13.107.3.128,TCP,54,54839  >  443 [ACK] Seq=182 Ack=6384 Win=255744 Len=0
146,6.609218,10.97.172.240,13.107.3.128,TCP,54,[TCP Window Update] 54839  >  443 [ACK] Seq=182 Ack=6384 Win=262144 Len=0
147,6.611088,52.232.69.150,10.97.172.240,TCP,66,"443  >  54840 [SYN, ACK] Seq=0 Ack=1 Win=8192 Len=0 MSS=1380 WS=256 SACK_PERM=1"
148,6.611226,10.97.172.240,52.232.69.150,TCP,54,54840  >  443 [ACK] Seq=1 Ack=1 Win=262144 Len=0
149,6.612141,10.97.172.240,52.232.69.150,TLSv1.2,245,Client Hello
150,6.621019,10.97.172.240,13.107.3.128,TLSv1.2,129,Client Key Exchange
151,6.621062,10.97.172.240,13.107.3.128,TLSv1.2,60,Change Cipher Spec
152,6.621062,10.97.172.240,13.107.3.128,TLSv1.2,99,Encrypted Handshake Message
153,6.626926,52.232.69.150,10.97.172.240,TCP,1434,443  >  54840 [ACK] Seq=1 Ack=192 Win=262144 Len=1380 [TCP segment of a reassembled PDU]
154,6.626933,52.232.69.150,10.97.172.240,TCP,1434,443  >  54840 [ACK] Seq=1381 Ack=192 Win=262144 Len=1380 [TCP segment of a reassembled PDU]
155,6.626934,52.232.69.150,10.97.172.240,TCP,1434,443  >  54840 [ACK] Seq=2761 Ack=192 Win=262144 Len=1380 [TCP segment of a reassembled PDU]
156,6.626936,52.232.69.150,10.97.172.240,TCP,292,"[TCP Previous segment not captured] 443  >  54840 [PSH, ACK] Seq=5521 Ack=192 Win=262144 Len=238 [TCP segment of a reassembled PDU]"
157,6.62703,10.97.172.240,52.232.69.150,TCP,54,54840  >  443 [ACK] Seq=192 Ack=2761 Win=259328 Len=0
158,6.627031,10.97.172.240,52.232.69.150,TCP,66,54840  >  443 [ACK] Seq=192 Ack=4141 Win=257984 Len=0 SLE=5521 SRE=5759
159,6.627096,10.97.172.240,52.232.69.150,TCP,66,[TCP Window Update] 54840  >  443 [ACK] Seq=192 Ack=4141 Win=262144 Len=0 SLE=5521 SRE=5759
160,6.630302,52.232.69.150,10.97.172.240,TCP,1434,[TCP Out-Of-Order] 443  >  54840 [ACK] Seq=4141 Ack=192 Win=262144 Len=1380
161,6.630305,13.107.3.128,10.97.172.240,TCP,54,443  >  54839 [ACK] Seq=6384 Ack=308 Win=524032 Len=0
162,6.630306,13.107.3.128,10.97.172.240,TLSv1.2,105,"Change Cipher Spec, Encrypted Handshake Message"
163,6.630356,10.97.172.240,13.107.3.128,TCP,54,54839  >  443 [ACK] Seq=308 Ack=6435 Win=262080 Len=0
164,6.630365,10.97.172.240,52.232.69.150,TCP,54,54840  >  443 [ACK] Seq=192 Ack=5759 Win=260480 Len=0
165,6.631103,10.97.172.240,13.107.3.128,TLSv1.2,716,Application Data
166,6.640155,10.97.172.240,52.232.69.150,TLSv1.2,129,Client Key Exchange
167,6.640155,10.97.172.240,52.232.69.150,TLSv1.2,60,Change Cipher Spec
168,6.640156,10.97.172.240,52.232.69.150,TLSv1.2,99,Encrypted Handshake Message
169,6.650904,52.232.69.150,10.97.172.240,TCP,1434,"[TCP Spurious Retransmission] 443  >  54840 [PSH, ACK] Seq=4379 Ack=192 Win=262144 Len=1380[Reassembly error, protocol TCP: New fragment overlaps old data (retransmission?)]"
170,6.650975,10.97.172.240,52.232.69.150,TCP,66,[TCP Dup ACK 164#1] 54840  >  443 [ACK] Seq=318 Ack=5759 Win=262144 Len=0 SLE=4379 SRE=5759
171,6.65658,13.107.3.128,10.97.172.240,TCP,54,443  >  54839 [ACK] Seq=6435 Ack=970 Win=523264 Len=0
172,6.664136,52.232.69.150,10.97.172.240,TCP,54,443  >  54840 [ACK] Seq=5759 Ack=318 Win=261888 Len=0
173,6.664814,52.232.69.150,10.97.172.240,TLSv1.2,105,"Change Cipher Spec, Encrypted Handshake Message"
174,6.664861,10.97.172.240,52.232.69.150,TCP,54,54840  >  443 [ACK] Seq=318 Ack=5810 Win=262080 Len=0
175,6.665371,10.97.172.240,52.232.69.150,TLSv1.2,778,Application Data
176,6.681214,13.107.3.128,10.97.172.240,TCP,1434,443  >  54839 [ACK] Seq=6435 Ack=970 Win=523264 Len=1380 [TCP segment of a reassembled PDU]
177,6.681224,13.107.3.128,10.97.172.240,TCP,1434,443  >  54839 [ACK] Seq=7815 Ack=970 Win=523264 Len=1380 [TCP segment of a reassembled PDU]
178,6.681226,13.107.3.128,10.97.172.240,TCP,95,"[TCP Previous segment not captured] 443  >  54839 [PSH, ACK] Seq=10575 Ack=970 Win=523264 Len=41 [TCP segment of a reassembled PDU]"
179,6.681347,10.97.172.240,13.107.3.128,TCP,54,54839  >  443 [ACK] Seq=970 Ack=9195 Win=259328 Len=0
180,6.681348,10.97.172.240,13.107.3.128,TCP,66,[TCP Dup ACK 179#1] 54839  >  443 [ACK] Seq=970 Ack=9195 Win=259328 Len=0 SLE=10575 SRE=10616
181,6.681512,10.97.172.240,13.107.3.128,TCP,66,[TCP Window Update] 54839  >  443 [ACK] Seq=970 Ack=9195 Win=262144 Len=0 SLE=10575 SRE=10616
182,6.682486,13.107.3.128,10.97.172.240,TCP,1434,[TCP Out-Of-Order] 443  >  54839 [ACK] Seq=9195 Ack=970 Win=523264 Len=1380
183,6.682492,13.107.3.128,10.97.172.240,TCP,1434,443  >  54839 [ACK] Seq=10616 Ack=970 Win=523264 Len=1380 [TCP segment of a reassembled PDU]
184,6.682494,13.107.3.128,10.97.172.240,TCP,222,"[TCP Previous segment not captured] 443  >  54839 [PSH, ACK] Seq=13376 Ack=970 Win=523264 Len=168 [TCP segment of a reassembled PDU]"
185,6.682496,13.107.3.128,10.97.172.240,TCP,1434,[TCP Out-Of-Order] 443  >  54839 [ACK] Seq=11996 Ack=970 Win=523264 Len=1380
186,6.682596,10.97.172.240,13.107.3.128,TCP,54,54839  >  443 [ACK] Seq=970 Ack=10616 Win=260672 Len=0
187,6.682597,10.97.172.240,13.107.3.128,TCP,66,54839  >  443 [ACK] Seq=970 Ack=11996 Win=259328 Len=0 SLE=13376 SRE=13544
188,6.682597,10.97.172.240,13.107.3.128,TCP,54,54839  >  443 [ACK] Seq=970 Ack=13544 Win=257792 Len=0
189,6.682746,10.97.172.240,13.107.3.128,TCP,54,[TCP Window Update] 54839  >  443 [ACK] Seq=970 Ack=13544 Win=262144 Len=0
190,6.685273,10.97.172.240,13.107.3.128,TCP,54,"54839  >  443 [FIN, ACK] Seq=970 Ack=13544 Win=262144 Len=0"
191,6.689632,13.107.3.128,10.97.172.240,TCP,54,443  >  54839 [ACK] Seq=13544 Ack=971 Win=523264 Len=0
192,6.690264,13.107.3.128,10.97.172.240,TCP,54,"443  >  54839 [FIN, ACK] Seq=13544 Ack=971 Win=523264 Len=0"
193,6.690354,10.97.172.240,13.107.3.128,TCP,54,54839  >  443 [ACK] Seq=971 Ack=13545 Win=262144 Len=0
194,6.69455,52.232.69.150,10.97.172.240,TCP,1434,443  >  54840 [ACK] Seq=5810 Ack=1042 Win=261120 Len=1380 [TCP segment of a reassembled PDU]
195,6.694557,52.232.69.150,10.97.172.240,TCP,1434,443  >  54840 [ACK] Seq=7190 Ack=1042 Win=261120 Len=1380 [TCP segment of a reassembled PDU]
196,6.694559,52.232.69.150,10.97.172.240,TCP,1434,443  >  54840 [ACK] Seq=8570 Ack=1042 Win=261120 Len=1380 [TCP segment of a reassembled PDU]
197,6.694561,52.232.69.150,10.97.172.240,TCP,1434,443  >  54840 [ACK] Seq=9950 Ack=1042 Win=261120 Len=1380 [TCP segment of a reassembled PDU]
198,6.694563,52.232.69.150,10.97.172.240,TCP,1434,443  >  54840 [ACK] Seq=11330 Ack=1042 Win=261120 Len=1380 [TCP segment of a reassembled PDU]
199,6.694571,52.232.69.150,10.97.172.240,TCP,1434,443  >  54840 [ACK] Seq=12710 Ack=1042 Win=261120 Len=1380 [TCP segment of a reassembled PDU]
200,6.694574,52.232.69.150,10.97.172.240,TCP,1434,443  >  54840 [ACK] Seq=14090 Ack=1042 Win=261120 Len=1380 [TCP segment of a reassembled PDU]
201,6.694576,52.232.69.150,10.97.172.240,TLSv1.2,1118,Application Data
202,6.694578,52.232.69.150,10.97.172.240,TLSv1.2,825,"[TCP Previous segment not captured] , Ignored Unknown Record"
203,6.694653,52.232.69.150,10.97.172.240,TCP,1434,[TCP Out-Of-Order] 443  >  54840 [ACK] Seq=16534 Ack=1042 Win=261120 Len=1380
204,6.694656,52.232.69.150,10.97.172.240,TLSv1.2,88,Application Data
205,6.694705,10.97.172.240,52.232.69.150,TCP,54,54840  >  443 [ACK] Seq=1042 Ack=8570 Win=259328 Len=0
206,6.694705,10.97.172.240,52.232.69.150,TCP,54,54840  >  443 [ACK] Seq=1042 Ack=11330 Win=256576 Len=0
207,6.694705,10.97.172.240,52.232.69.150,TCP,54,54840  >  443 [ACK] Seq=1042 Ack=14090 Win=253824 Len=0
208,6.694768,10.97.172.240,52.232.69.150,TCP,54,54840  >  443 [ACK] Seq=1042 Ack=16534 Win=251392 Len=0
209,6.694768,10.97.172.240,52.232.69.150,TCP,66,[TCP Dup ACK 208#1] 54840  >  443 [ACK] Seq=1042 Ack=16534 Win=251392 Len=0 SLE=17914 SRE=18685
210,6.694769,10.97.172.240,52.232.69.150,TCP,54,54840  >  443 [ACK] Seq=1042 Ack=18685 Win=249216 Len=0
211,6.694769,10.97.172.240,52.232.69.150,TCP,54,54840  >  443 [ACK] Seq=1042 Ack=18719 Win=249216 Len=0
212,6.69477,10.97.172.240,52.232.69.150,TCP,54,[TCP Window Update] 54840  >  443 [ACK] Seq=1042 Ack=18719 Win=262144 Len=0
213,6.696279,10.97.172.240,52.232.69.150,TCP,54,"54840  >  443 [FIN, ACK] Seq=1042 Ack=18719 Win=262144 Len=0"
214,6.709992,52.232.69.150,10.97.172.240,TCP,54,"443  >  54840 [FIN, ACK] Seq=18719 Ack=1043 Win=261120 Len=0"
215,6.710112,10.97.172.240,52.232.69.150,TCP,54,54840  >  443 [ACK] Seq=1043 Ack=18720 Win=262144 Len=0
216,7.353716,10.97.172.240,17.248.144.240,TLSv1.2,85,Encrypted Alert
217,7.354642,10.97.172.240,17.248.144.240,TCP,54,"54819  >  443 [FIN, ACK] Seq=32 Ack=1 Win=4096 Len=0"
218,7.359668,17.248.144.240,10.97.172.240,TCP,54,"443  >  54819 [FIN, ACK] Seq=1 Ack=32 Win=982 Len=0"
219,7.359675,17.248.144.240,10.97.172.240,TCP,54,443  >  54819 [ACK] Seq=2 Ack=33 Win=982 Len=0
220,7.359824,10.97.172.240,17.248.144.240,TCP,54,"[TCP Retransmission] 54819  >  443 [FIN, ACK] Seq=32 Ack=2 Win=4096 Len=0"
221,7.987836,13.81.211.255,10.97.172.240,TCP,54,"443  >  54813 [RST, ACK] Seq=1 Ack=1 Win=0 Len=0"
222,8.533591,10.97.172.240,52.232.69.150,TCP,78,54841  >  443 [SYN] Seq=0 Win=65535 Len=0 MSS=1460 WS=64 TSval=1089648803 TSecr=0 SACK_PERM=1
223,8.546453,52.232.69.150,10.97.172.240,TCP,66,"443  >  54841 [SYN, ACK] Seq=0 Ack=1 Win=8192 Len=0 MSS=1380 WS=256 SACK_PERM=1"
224,8.546561,10.97.172.240,52.232.69.150,TCP,54,54841  >  443 [ACK] Seq=1 Ack=1 Win=262144 Len=0
225,8.547555,10.97.172.240,52.232.69.150,TLSv1.2,245,Client Hello
226,8.562913,52.232.69.150,10.97.172.240,TCP,1434,443  >  54841 [ACK] Seq=1 Ack=192 Win=262144 Len=1380 [TCP segment of a reassembled PDU]
227,8.56292,52.232.69.150,10.97.172.240,TCP,1434,443  >  54841 [ACK] Seq=1381 Ack=192 Win=262144 Len=1380 [TCP segment of a reassembled PDU]
228,8.562921,52.232.69.150,10.97.172.240,TCP,1434,443  >  54841 [ACK] Seq=2761 Ack=192 Win=262144 Len=1380 [TCP segment of a reassembled PDU]
229,8.562923,52.232.69.150,10.97.172.240,TCP,1434,443  >  54841 [ACK] Seq=4141 Ack=192 Win=262144 Len=1380 [TCP segment of a reassembled PDU]
230,8.562925,52.232.69.150,10.97.172.240,TLSv1.2,292,"Server Hello, Certificate, Certificate Status, Server Key Exchange, Server Hello Done"
231,8.563075,10.97.172.240,52.232.69.150,TCP,54,54841  >  443 [ACK] Seq=192 Ack=2761 Win=259328 Len=0
232,8.563076,10.97.172.240,52.232.69.150,TCP,54,54841  >  443 [ACK] Seq=192 Ack=5521 Win=256576 Len=0
233,8.563076,10.97.172.240,52.232.69.150,TCP,54,54841  >  443 [ACK] Seq=192 Ack=5759 Win=256384 Len=0
234,8.563145,10.97.172.240,52.232.69.150,TCP,54,[TCP Window Update] 54841  >  443 [ACK] Seq=192 Ack=5759 Win=262144 Len=0
235,8.575078,10.97.172.240,52.232.69.150,TLSv1.2,129,Client Key Exchange
236,8.575123,10.97.172.240,52.232.69.150,TLSv1.2,60,Change Cipher Spec
237,8.575137,10.97.172.240,52.232.69.150,TLSv1.2,99,Encrypted Handshake Message
238,8.587147,52.232.69.150,10.97.172.240,TCP,54,443  >  54841 [ACK] Seq=5759 Ack=273 Win=261888 Len=0
239,8.587511,52.232.69.150,10.97.172.240,TLSv1.2,105,"Change Cipher Spec, Encrypted Handshake Message"
240,8.587552,10.97.172.240,52.232.69.150,TCP,54,54841  >  443 [ACK] Seq=318 Ack=5810 Win=262080 Len=0
241,8.587846,10.97.172.240,52.232.69.150,TLSv1.2,812,Application Data
242,8.613848,52.232.69.150,10.97.172.240,TCP,1434,443  >  54841 [ACK] Seq=5810 Ack=1076 Win=261120 Len=1380 [TCP segment of a reassembled PDU]
243,8.613853,52.232.69.150,10.97.172.240,TCP,1434,443  >  54841 [ACK] Seq=7190 Ack=1076 Win=261120 Len=1380 [TCP segment of a reassembled PDU]
244,8.613854,52.232.69.150,10.97.172.240,TCP,1434,443  >  54841 [ACK] Seq=8570 Ack=1076 Win=261120 Len=1380 [TCP segment of a reassembled PDU]
245,8.613855,52.232.69.150,10.97.172.240,TCP,1434,443  >  54841 [ACK] Seq=9950 Ack=1076 Win=261120 Len=1380 [TCP segment of a reassembled PDU]
246,8.613855,52.232.69.150,10.97.172.240,TCP,1434,443  >  54841 [ACK] Seq=11330 Ack=1076 Win=261120 Len=1380 [TCP segment of a reassembled PDU]
247,8.613861,52.232.69.150,10.97.172.240,TCP,1434,443  >  54841 [ACK] Seq=12710 Ack=1076 Win=261120 Len=1380 [TCP segment of a reassembled PDU]
248,8.613862,52.232.69.150,10.97.172.240,TCP,1434,443  >  54841 [ACK] Seq=14090 Ack=1076 Win=261120 Len=1380 [TCP segment of a reassembled PDU]
249,8.613863,52.232.69.150,10.97.172.240,TCP,818,"[TCP Previous segment not captured] 443  >  54841 [PSH, ACK] Seq=16850 Ack=1076 Win=261120 Len=764 [TCP segment of a reassembled PDU]"
250,8.613894,52.232.69.150,10.97.172.240,TCP,1434,[TCP Out-Of-Order] 443  >  54841 [ACK] Seq=15470 Ack=1076 Win=261120 Len=1380
251,8.613895,52.232.69.150,10.97.172.240,TLSv1.2,467,"[TCP Previous segment not captured] , Ignored Unknown Record"
252,8.613896,52.232.69.150,10.97.172.240,TLSv1.2,88,Application Data
253,8.613896,52.232.69.150,10.97.172.240,TCP,1434,[TCP Out-Of-Order] 443  >  54841 [ACK] Seq=17614 Ack=1076 Win=261120 Len=1380
254,8.613941,10.97.172.240,52.232.69.150,TCP,54,54841  >  443 [ACK] Seq=1076 Ack=8570 Win=259328 Len=0
255,8.613942,10.97.172.240,52.232.69.150,TCP,54,54841  >  443 [ACK] Seq=1076 Ack=11330 Win=256576 Len=0
256,8.613988,10.97.172.240,52.232.69.150,TCP,54,54841  >  443 [ACK] Seq=1076 Ack=14090 Win=253824 Len=0
257,8.613988,10.97.172.240,52.232.69.150,TCP,66,54841  >  443 [ACK] Seq=1076 Ack=15470 Win=252480 Len=0 SLE=16850 SRE=17614
258,8.613988,10.97.172.240,52.232.69.150,TCP,54,54841  >  443 [ACK] Seq=1076 Ack=17614 Win=250304 Len=0
259,8.613988,10.97.172.240,52.232.69.150,TCP,66,[TCP Dup ACK 258#1] 54841  >  443 [ACK] Seq=1076 Ack=17614 Win=250304 Len=0 SLE=23134 SRE=23547
260,8.613988,10.97.172.240,52.232.69.150,TCP,66,[TCP Dup ACK 258#2] 54841  >  443 [ACK] Seq=1076 Ack=17614 Win=250304 Len=0 SLE=23134 SRE=23581
261,8.613989,10.97.172.240,52.232.69.150,TCP,66,54841  >  443 [ACK] Seq=1076 Ack=18994 Win=248960 Len=0 SLE=23134 SRE=23581
262,8.61407,52.232.69.150,10.97.172.240,TCP,1434,[TCP Out-Of-Order] 443  >  54841 [ACK] Seq=18994 Ack=1076 Win=261120 Len=1380
263,8.614072,52.232.69.150,10.97.172.240,TCP,1434,[TCP Out-Of-Order] 443  >  54841 [ACK] Seq=20374 Ack=1076 Win=261120 Len=1380
264,8.614073,52.232.69.150,10.97.172.240,TCP,1434,[TCP Out-Of-Order] 443  >  54841 [ACK] Seq=21754 Ack=1076 Win=261120 Len=1380
265,8.61408,10.97.172.240,52.232.69.150,TCP,66,[TCP Window Update] 54841  >  443 [ACK] Seq=1076 Ack=18994 Win=262144 Len=0 SLE=23134 SRE=23581
266,8.614104,10.97.172.240,52.232.69.150,TCP,66,54841  >  443 [ACK] Seq=1076 Ack=20374 Win=260736 Len=0 SLE=23134 SRE=23581
267,8.614104,10.97.172.240,52.232.69.150,TCP,66,54841  >  443 [ACK] Seq=1076 Ack=21754 Win=259328 Len=0 SLE=23134 SRE=23581
268,8.614104,10.97.172.240,52.232.69.150,TCP,54,54841  >  443 [ACK] Seq=1076 Ack=23581 Win=257536 Len=0
269,8.614175,10.97.172.240,52.232.69.150,TCP,54,[TCP Window Update] 54841  >  443 [ACK] Seq=1076 Ack=23581 Win=262144 Len=0
270,8.61515,10.97.172.240,52.232.69.150,TCP,54,"54841  >  443 [FIN, ACK] Seq=1076 Ack=23581 Win=262144 Len=0"
271,8.627922,52.232.69.150,10.97.172.240,TCP,54,"443  >  54841 [FIN, ACK] Seq=23581 Ack=1077 Win=261120 Len=0"
272,8.628003,10.97.172.240,52.232.69.150,TCP,54,54841  >  443 [ACK] Seq=1077 Ack=23582 Win=262144 Len=0
273,9.565796,10.97.172.240,13.73.144.98,TLSv1.2,113,Application Data
274,9.577284,13.73.144.98,10.97.172.240,TLSv1.2,102,Application Data
275,9.577394,10.97.172.240,13.73.144.98,TCP,54,52575  >  443 [ACK] Seq=60 Ack=49 Win=4095 Len=0
276,12.061228,13.94.211.113,10.97.172.240,TLSv1.2,107,Application Data
277,12.061282,10.97.172.240,13.94.211.113,TCP,54,53454  >  443 [ACK] Seq=1 Ack=54 Win=4095 Len=0
278,12.061432,10.97.172.240,13.94.211.113,TLSv1.2,107,Application Data
279,12.107689,10.97.172.240,13.94.211.113,TCP,107,"[TCP Retransmission] 53454  >  443 [PSH, ACK] Seq=1 Ack=54 Win=4096 Len=53"
280,12.118085,13.94.211.113,10.97.172.240,TCP,66,443  >  53454 [ACK] Seq=54 Ack=54 Win=506 Len=0 SLE=1 SRE=54
281,12.479025,52.109.28.2,10.97.172.240,TLSv1.2,89,Application Data
282,12.479078,10.97.172.240,52.109.28.2,TCP,54,54753  >  443 [ACK] Seq=1 Ack=36 Win=4095 Len=0
283,12.479218,10.97.172.240,52.109.28.2,TLSv1.2,89,Application Data
284,12.537255,52.109.28.2,10.97.172.240,TCP,54,443  >  54753 [ACK] Seq=36 Ack=36 Win=1019 Len=0
285,12.537304,10.97.172.240,52.109.28.2,TLSv1.2,87,Application Data
286,12.582567,10.97.172.240,52.109.28.2,TCP,87,"[TCP Retransmission] 54753  >  443 [PSH, ACK] Seq=36 Ack=36 Win=4096 Len=33"
287,12.588528,52.109.28.2,10.97.172.240,TCP,66,443  >  54753 [ACK] Seq=36 Ack=69 Win=1018 Len=0 SLE=36 SRE=69
288,16.135462,66.228.33.150,10.97.172.240,TLSv1.2,88,Application Data
289,16.135557,10.97.172.240,66.228.33.150,TCP,54,54447  >  443 [ACK] Seq=1 Ack=35 Win=4095 Len=0
290,16.137738,10.97.172.240,66.228.33.150,TLSv1.2,92,Application Data
291,16.213238,66.228.33.150,10.97.172.240,TCP,54,443  >  54447 [ACK] Seq=35 Ack=39 Win=268 Len=0
292,16.654176,10.97.172.240,193.60.250.1,DNS,87,Standard query 0x2a13 A api-glb-lon.smoot.apple.com
293,16.656445,10.97.172.240,17.252.11.246,TCP,78,54842  >  443 [SYN] Seq=0 Win=65535 Len=0 MSS=1460 WS=64 TSval=1089656903 TSecr=0 SACK_PERM=1 TFO=R
294,16.658476,193.60.250.1,10.97.172.240,DNS,171,Standard query response 0x2a13 A api-glb-lon.smoot.apple.com A 17.252.11.246 NS ns2.smoot.apple.com NS ns1.smoot.apple.com A 17.253.217.54 A 17.253.217.53
295,16.661121,17.252.11.246,10.97.172.240,TCP,66,"443  >  54842 [SYN, ACK] Seq=0 Ack=1 Win=29200 Len=0 MSS=1380 SACK_PERM=1 WS=512"
296,16.661205,10.97.172.240,17.252.11.246,TLSv1.2,571,Client Hello
297,16.665255,17.252.11.246,10.97.172.240,TLSv1.2,191,"Server Hello, Change Cipher Spec, Encrypted Handshake Message"
298,16.665309,10.97.172.240,17.252.11.246,TCP,54,54842  >  443 [ACK] Seq=518 Ack=138 Win=261952 Len=0
299,16.665731,10.97.172.240,17.252.11.246,TLSv1.2,105,"Change Cipher Spec, Encrypted Handshake Message"
300,16.70907,17.252.11.246,10.97.172.240,TCP,54,443  >  54842 [ACK] Seq=138 Ack=569 Win=30720 Len=0
301,17.31524,10.97.172.240,193.60.250.1,DNS,79,Standard query 0x729b A clients1.google.com
302,17.31878,193.60.250.1,10.97.172.240,DNS,367,Standard query response 0x729b A clients1.google.com CNAME clients.l.google.com A 216.58.206.142 NS ns1.google.com NS ns2.google.com NS ns3.google.com NS ns4.google.com A 216.239.36.10 AAAA 2001:4860:4802:36::a A 216.239.34.10 AAAA 2001:4860:4802:34::a A 216.239.38.10 AAAA 2001:4860:4802:38::a A 216.239.32.10 AAAA 2001:4860:4802:32::a
303,17.333363,10.97.172.240,216.58.206.142,TCP,78,54843  >  443 [SYN] Seq=0 Win=65535 Len=0 MSS=1460 WS=64 TSval=1089657575 TSecr=0 SACK_PERM=1
304,17.336141,216.58.206.142,10.97.172.240,TCP,66,"443  >  54843 [SYN, ACK] Seq=0 Ack=1 Win=60720 Len=0 MSS=1380 SACK_PERM=1 WS=256"
305,17.336201,10.97.172.240,216.58.206.142,TCP,54,54843  >  443 [ACK] Seq=1 Ack=1 Win=262144 Len=0
306,17.336667,10.97.172.240,216.58.206.142,TLSv1.2,304,Client Hello
307,17.33918,216.58.206.142,10.97.172.240,TCP,54,443  >  54843 [ACK] Seq=1 Ack=251 Win=61952 Len=0
308,17.344698,216.58.206.142,10.97.172.240,TLSv1.2,1434,Server Hello
309,17.344964,216.58.206.142,10.97.172.240,TCP,906,"[TCP Previous segment not captured] 443  >  54843 [PSH, ACK] Seq=2761 Ack=251 Win=61952 Len=852 [TCP segment of a reassembled PDU], Server Key Exchange, Server Hello Done"
310,17.344966,216.58.206.142,10.97.172.240,TCP,1434,[TCP Out-Of-Order] 443  >  54843 [ACK] Seq=1381 Ack=251 Win=61952 Len=1380
311,17.345003,10.97.172.240,216.58.206.142,TCP,66,54843  >  443 [ACK] Seq=251 Ack=1381 Win=262144 Len=0 SLE=2761 SRE=3613
312,17.345003,10.97.172.240,216.58.206.142,TCP,54,54843  >  443 [ACK] Seq=251 Ack=3613 Win=259904 Len=0
313,17.349509,10.97.172.240,216.58.206.142,TLSv1.2,147,"Client Key Exchange, Change Cipher Spec, Encrypted Handshake Message"
314,17.352309,216.58.206.142,10.97.172.240,TLSv1.2,105,"Change Cipher Spec, Encrypted Handshake Message"
315,17.352358,10.97.172.240,216.58.206.142,TCP,54,54843  >  443 [ACK] Seq=344 Ack=3664 Win=262080 Len=0
316,17.352648,216.58.206.142,10.97.172.240,TLSv1.2,123,Application Data
317,17.352671,10.97.172.240,216.58.206.142,TCP,54,54843  >  443 [ACK] Seq=344 Ack=3733 Win=262016 Len=0
318,17.3556,10.97.172.240,216.58.206.142,TLSv1.2,107,Application Data
319,17.355708,10.97.172.240,216.58.206.142,TLSv1.2,104,Application Data
320,17.355742,10.97.172.240,216.58.206.142,TLSv1.2,96,Application Data
321,17.355764,10.97.172.240,216.58.206.142,TLSv1.2,251,Application Data
322,17.355853,10.97.172.240,216.58.206.142,TLSv1.2,92,Application Data
323,17.35821,216.58.206.142,10.97.172.240,TCP,54,443  >  54843 [ACK] Seq=3733 Ack=447 Win=61952 Len=0
324,17.358487,216.58.206.142,10.97.172.240,TLSv1.2,92,Application Data
325,17.358488,216.58.206.142,10.97.172.240,TCP,54,443  >  54843 [ACK] Seq=3771 Ack=686 Win=62976 Len=0
326,17.358524,10.97.172.240,216.58.206.142,TCP,54,54843  >  443 [ACK] Seq=724 Ack=3771 Win=262080 Len=0
327,17.389974,216.58.206.142,10.97.172.240,TLSv1.2,436,Application Data
328,17.390042,10.97.172.240,216.58.206.142,TCP,54,54843  >  443 [ACK] Seq=724 Ack=4153 Win=261760 Len=0
329,17.39076,216.58.206.142,10.97.172.240,TLSv1.2,255,Application Data
330,17.390786,10.97.172.240,216.58.206.142,TCP,54,54843  >  443 [ACK] Seq=724 Ack=4354 Win=261888 Len=0
331,17.393436,216.58.206.142,10.97.172.240,TLSv1.2,296,Application Data
332,17.393465,10.97.172.240,216.58.206.142,TCP,54,54843  >  443 [ACK] Seq=724 Ack=4596 Win=261888 Len=0
333,17.394477,216.58.206.142,10.97.172.240,TLSv1.2,117,Application Data
334,17.3945,10.97.172.240,216.58.206.142,TCP,54,54843  >  443 [ACK] Seq=724 Ack=4659 Win=262080 Len=0
335,17.394836,216.58.206.142,10.97.172.240,TLSv1.2,100,Application Data
336,17.394858,10.97.172.240,216.58.206.142,TCP,54,54843  >  443 [ACK] Seq=724 Ack=4705 Win=262080 Len=0
337,17.395074,10.97.172.240,216.58.206.142,TLSv1.2,100,Application Data
338,17.437942,216.58.206.142,10.97.172.240,TCP,54,443  >  54843 [ACK] Seq=4705 Ack=770 Win=62976 Len=0
339,17.483509,10.97.172.240,169.55.74.45,TLSv1.2,92,Application Data
340,17.489497,10.97.172.240,255.255.255.255,DB-LSP-DISC,188,Dropbox LAN sync Discovery Protocol
341,17.489709,10.97.172.240,10.97.255.255,DB-LSP-DISC,188,Dropbox LAN sync Discovery Protocol
342,17.508486,10.97.172.240,216.58.206.142,TLSv1.2,143,Application Data
343,17.50951,10.97.172.240,17.252.11.246,TLSv1.2,827,Application Data
344,17.511097,216.58.206.142,10.97.172.240,TCP,54,443  >  54843 [ACK] Seq=4705 Ack=859 Win=62976 Len=0
345,17.513219,17.252.11.246,10.97.172.240,TCP,54,443  >  54842 [ACK] Seq=138 Ack=1342 Win=32256 Len=0
346,17.542934,17.252.11.246,10.97.172.240,TLSv1.2,810,Application Data
347,17.54299,10.97.172.240,17.252.11.246,TCP,54,54842  >  443 [ACK] Seq=1342 Ack=894 Win=261376 Len=0
348,17.559558,169.55.74.45,10.97.172.240,TLSv1.2,99,Application Data
349,17.559609,10.97.172.240,169.55.74.45,TCP,54,54360  >  443 [ACK] Seq=39 Ack=46 Win=4095 Len=0
350,17.648404,216.58.206.142,10.97.172.240,TLSv1.2,153,Application Data
351,17.648462,10.97.172.240,216.58.206.142,TCP,54,54843  >  443 [ACK] Seq=859 Ack=4804 Win=262016 Len=0
352,17.648675,216.58.206.142,10.97.172.240,TLSv1.2,317,Application Data
353,17.648704,10.97.172.240,216.58.206.142,TCP,54,54843  >  443 [ACK] Seq=859 Ack=5067 Win=261824 Len=0
354,17.649451,10.97.172.240,193.60.250.1,DNS,87,Standard query 0xb1e3 A star-mini.c10r.facebook.com
355,17.651215,216.58.206.142,10.97.172.240,TLSv1.2,179,Application Data
356,17.651255,10.97.172.240,216.58.206.142,TCP,54,54843  >  443 [ACK] Seq=859 Ack=5192 Win=262016 Len=0
357,17.651944,216.58.206.142,10.97.172.240,TLSv1.2,279,Application Data
358,17.651985,10.97.172.240,216.58.206.142,TCP,54,54843  >  443 [ACK] Seq=859 Ack=5417 Win=261888 Len=0
359,17.652613,216.58.206.142,10.97.172.240,TLSv1.2,100,Application Data
360,17.652651,10.97.172.240,216.58.206.142,TCP,54,54843  >  443 [ACK] Seq=859 Ack=5463 Win=262080 Len=0
361,17.652791,10.97.172.240,216.58.206.142,TLSv1.2,100,Application Data
362,17.652879,193.60.250.1,10.97.172.240,DNS,226,Standard query response 0xb1e3 A star-mini.c10r.facebook.com A 157.240.1.35 NS b.ns.c10r.facebook.com NS a.ns.c10r.facebook.com A 69.171.239.11 AAAA 2a03:2880:fffe:b:face:b00c::99 A 69.171.255.11 AAAA 2a03:2880:ffff:b:face:b00c::99
363,17.655438,216.58.206.142,10.97.172.240,TCP,54,443  >  54843 [ACK] Seq=5463 Ack=905 Win=62976 Len=0
364,17.659932,10.97.172.240,157.240.1.35,TCP,78,54845  >  443 [SYN] Seq=0 Win=65535 Len=0 MSS=1460 WS=64 TSval=1089657889 TSecr=0 SACK_PERM=1
365,17.660343,10.97.172.240,54.247.166.143,HTTP,182,GET /V3/01/35.1.240.157.ip/ HTTP/1.1 
366,17.660836,10.97.172.240,54.247.166.143,HTTP,185,GET /V3/01/jjj.snprobbx.pbz.w/ HTTP/1.1 
367,17.663707,157.240.1.35,10.97.172.240,TCP,66,"443  >  54845 [SYN, ACK] Seq=0 Ack=1 Win=28200 Len=0 MSS=1380 SACK_PERM=1 WS=256"
